{
  "schemaVersion": "4.2.0",
  "asOf": "2026-10-16",
  "purpose": "Public legal discovery index for Russia–Ukraine peace and regeneration analysis. NOT an exhaustive legislation library.",
  "caveats": [
    "Directory entries are navigation aids, not legal opinions or confirmations of current force.",
    "EU law and domestic law may apply jointly; ECHR, IHL and treaty systems must be distinguished.",
    "Legislation can be amended daily; always recheck the full instrument, implementation measures and current official status.",
    "Publisher links do not prove applicability, sanctions licenses, institution involvement or a conflict party agreement.",
    "Country metadata and summaries are offline; the actual law text is accessible only through the external website unless independently downloaded with permission.",
    "Countries without independently confirmed primary-source portals are not included; regional, local, sanctions and treaty documentation remains selective rather than exhaustive."
  ],
  "jurisdictions": [
    {
      "id": "ua",
      "label": "Ukraine",
      "level": "national",
      "language": "Ukrainian",
      "legalNote": "Ukraine's constitutional and legislative authorities govern Ukrainian territory. Validate promulgation and any wartime restrictions."
    },
    {
      "id": "ru",
      "label": "Russian Federation",
      "level": "national",
      "language": "Russian",
      "legalNote": "Russian legislation is not a source of authority to change Ukrainian sovereignty. Assess conflicts with international law."
    },
    {
      "id": "eu",
      "label": "European Union",
      "level": "supranational",
      "language": "Multiple EU languages",
      "legalNote": "EU law binds within its competence; sanctions and asset measures require version-specific checks."
    },
    {
      "id": "us",
      "label": "United States",
      "level": "national",
      "language": "English",
      "legalNote": "Distinguish Congressional acts, executive orders, implementing regulations and licenses."
    },
    {
      "id": "gb",
      "label": "United Kingdom",
      "level": "national",
      "language": "English",
      "legalNote": "Check current consolidated sanctions regulations, licenses and commencement dates."
    },
    {
      "id": "ca",
      "label": "Canada",
      "level": "national",
      "language": "English/French",
      "legalNote": "Consult amended sanctions regulations and enabling acts; confirm current designations and permits."
    },
    {
      "id": "pl",
      "label": "Poland",
      "level": "national",
      "language": "Polish",
      "legalNote": "As an EU member, Poland applies relevant EU measures plus national rules; consult promulgated versions."
    },
    {
      "id": "de",
      "label": "Germany",
      "level": "national",
      "language": "German",
      "legalNote": "Review national legislation alongside directly applicable EU regulations and German implementation rules."
    },
    {
      "id": "fr",
      "label": "France",
      "level": "national",
      "language": "French",
      "legalNote": "Review Légifrance, official journal and relevant directly applicable EU regulations."
    },
    {
      "id": "tr",
      "label": "Türkiye",
      "level": "national",
      "language": "Turkish",
      "legalNote": "Check the Official Gazette and treaty positions independently; EU sanctions do not automatically apply."
    },
    {
      "id": "ch",
      "label": "Switzerland",
      "level": "national",
      "language": "German/French/Italian",
      "legalNote": "Swiss sanctions law and independent federal measures require separate review."
    },
    {
      "id": "cn",
      "label": "China",
      "level": "national",
      "language": "Chinese",
      "legalNote": "Review official statutory instruments and governmental positions separately."
    },
    {
      "id": "jp",
      "label": "Japan",
      "level": "national",
      "language": "Japanese",
      "legalNote": "Japanese regulatory and sanctions measures require Ministry and law-level verification."
    },
    {
      "id": "un",
      "label": "United Nations",
      "level": "international",
      "language": "Multiple UN languages",
      "legalNote": "Treaty participation, UNSC resolutions and recommendations have distinct legal force and addressee."
    },
    {
      "id": "coe",
      "label": "Council of Europe / ECHR",
      "level": "international",
      "language": "English/French",
      "legalNote": "Convention jurisdiction and temporal limitations must be checked for each respondent and claim."
    },
    {
      "id": "osce",
      "label": "OSCE",
      "level": "international",
      "language": "English/other",
      "legalNote": "OSCE commitments, missions and deployments require differentiated mandates; do not assume old missions persist."
    },
    {
      "id": "iaea",
      "label": "IAEA",
      "level": "international",
      "language": "English/other",
      "legalNote": "Nuclear safeguards and safety monitoring do not create unilateral military enforcement authority."
    },
    {
      "id": "icrc",
      "label": "ICRC IHL references",
      "level": "reference",
      "language": "English/other",
      "legalNote": "ICRC databases provide humanitarian law texts and status information, not permission for military operations."
    },
    {
      "id": "be",
      "label": "Belgium",
      "level": "national",
      "language": "French/Dutch/German",
      "legalNote": "Belgian official gazette and national legislation require separate review, notably for asset-custody questions."
    },
    {
      "id": "nl",
      "label": "Netherlands",
      "level": "national",
      "language": "Dutch",
      "legalNote": "National rules and EU restrictive measures should be reviewed together."
    },
    {
      "id": "it",
      "label": "Italy",
      "level": "national",
      "language": "Italian",
      "legalNote": "Italian promulgation, consolidation and EU sanctions requirements must be considered separately."
    },
    {
      "id": "no",
      "label": "Norway",
      "level": "national",
      "language": "Norwegian",
      "legalNote": "Norway is not an EU member; check implementing measures and its own sanctions rules."
    },
    {
      "id": "se",
      "label": "Sweden",
      "level": "national",
      "language": "Swedish",
      "legalNote": "Swedish official promulgation and EU law are separate legal layers."
    },
    {
      "id": "dk",
      "label": "Denmark",
      "level": "national",
      "language": "Danish",
      "legalNote": "National legislative database and EU restrictions must both be consulted."
    },
    {
      "id": "ee",
      "label": "Estonia",
      "level": "national",
      "language": "Estonian/English",
      "legalNote": "National published laws and directly applicable EU law should be read together."
    },
    {
      "id": "lv",
      "label": "Latvia",
      "level": "national",
      "language": "Latvian",
      "legalNote": "Use current national-law versions plus EU sanctions where applicable."
    },
    {
      "id": "lt",
      "label": "Lithuania",
      "level": "national",
      "language": "Lithuanian/English",
      "legalNote": "Check the register and effective text alongside EU instruments."
    },
    {
      "id": "ro",
      "label": "Romania",
      "level": "national",
      "language": "Romanian",
      "legalNote": "Check the official legislative portal and applicable EU law for the exact sector."
    },
    {
      "id": "fi",
      "label": "Finland",
      "level": "national",
      "language": "Finnish / Swedish",
      "legalNote": "Review Finnish domestic law alongside binding EU restrictions; translated online documents may not be authoritative."
    },
    {
      "id": "in",
      "label": "India",
      "level": "national",
      "language": "Hindi / English",
      "legalNote": "Independent Indian legal nexus and competent authority analysis required; third-country trade must not automatically be labeled illicit war financing."
    }
  ],
  "documents": [
    {
      "id": "law-001",
      "jurisdictionId": "ua",
      "kind": "instrument",
      "category": "constitutional",
      "title": "Constitution of Ukraine",
      "url": "https://zakon.rada.gov.ua/laws/show/en/254%D0%BA/96-%D0%B2%D1%80",
      "note": "Articles 2 and 73 affect territorial integrity and all-Ukrainian referenda; verify official text and wartime rules.",
      "language": "en",
      "changeRisk": "medium",
      "topicTags": [
        "sovereignty",
        "territory",
        "governance"
      ],
      "reviewedOn": "2026-10-16",
      "verification": "publisher-link-reviewed",
      "legalStatus": "Recheck current legal effect and applicability; registry does not certify validity",
      "sourceType": "instrument"
    },
    {
      "id": "law-002",
      "jurisdictionId": "ua",
      "kind": "repository",
      "category": "legislation",
      "title": "Verkhovna Rada legislation repository",
      "url": "https://zakon.rada.gov.ua/laws/main/en/",
      "note": "Search adopted laws, codes, regulations, and issuer metadata; informational database rather than official printed edition.",
      "language": "en/uk",
      "changeRisk": "high",
      "topicTags": [
        "governance",
        "sanctions",
        "reconstruction"
      ],
      "reviewedOn": "2026-10-16",
      "verification": "publisher-link-reviewed",
      "legalStatus": "Recheck current legal effect and applicability; registry does not certify validity",
      "sourceType": "discovery"
    },
    {
      "id": "law-003",
      "jurisdictionId": "ua",
      "kind": "repository",
      "category": "legislation",
      "title": "Verkhovna Rada documents by issuer",
      "url": "https://zakon.rada.gov.ua/laws/main/o1?lang=en",